{
  "schema_version": 1,
  "mode": "project_fr_board_state",
  "project": "demo-project",
  "run_id": "20260708T000000Z_demo",
  "generated_at": "2026-07-08T00:00:00Z",
  "cards": [
    {
      "id": "GENERATED-TBT-016-ASVS-A",
      "lane": "import",
      "source": "generated",
      "title": "Expired JWT rejection for FR-016",
      "native_path": "",
      "pack_path": "tests/asvs/integration/TBT-016-ASVS-A.assurance.test.js",
      "tbt": "TBT-016-ASVS-A",
      "frs": ["FR-016"],
      "target": "FR-016 / TBT-016-ASVS-A",
      "recommendation": "",
      "decision": "approve_to_run",
      "reviewer_note": "Human reviewer approved this non-destructive test for execution.",
      "manual_test_path": "tests/asvs/integration/TBT-016-ASVS-A.assurance.test.js",
      "agentic_rationale": "",
      "discovery_rationale": "Implemented approved assurance test is ready to run.",
      "confidence": "high",
      "type": "integration",
      "status": "ready_to_run",
      "assessment": "useful_as_is",
      "safety": "non_destructive",
      "updated_at": "2026-07-08T00:00:00Z"
    }
  ]
}
